{
  "document_type": "embeadings-capabilities",
  "protocol_version": 1,
  "role": "producer",
  "schema_versions": [1],
  "report_types": ["neighbors", "neighbors-batch", "batch", "sweep", "triage", "collisions", "mentions", "orphans", "match", "superseded", "packet"],
  "capabilities": ["additive-fields", "advisory-evidence", "read-only-review", "code-surface-pointers"],
  "required_capabilities": ["read-only-review"]
}
